{
  "$schema": "https://json-schema.org/draft/2020-12/schema",
  "$id": "urn:ashare:wave-e:HistoricalBacktestReadiness:1.0.0",
  "title": "HistoricalBacktestReadiness",
  "type": "object",
  "additionalProperties": false,
  "required": [
    "contract_name",
    "contract_version",
    "object_version",
    "object_id",
    "trace_id",
    "namespace",
    "symbols",
    "labels",
    "decision_cutoff",
    "retrieval_cutoff",
    "timezone",
    "source_identity",
    "rules_hash",
    "code_hash",
    "schema_hash",
    "predecessor_hash",
    "content_hash",
    "source_admission",
    "formal_source_admission",
    "reason_codes",
    "invalidation_conditions",
    "provider_identity_verified",
    "license_verified",
    "transport_integrity_verified",
    "historical_visibility_proven",
    "cloud_transfer",
    "tradeable",
    "production_eligible",
    "can_produce_order",
    "productionGate",
    "body"
  ],
  "properties": {
    "contract_name": {
      "const": "HistoricalBacktestReadiness"
    },
    "contract_version": {
      "const": "1.0.0"
    },
    "object_version": {
      "const": 1
    },
    "object_id": {
      "type": "string",
      "pattern": "^wave-e:"
    },
    "trace_id": {
      "type": "string",
      "pattern": "^wave-e:"
    },
    "namespace": {
      "const": "LOCAL_ENGINE_DIAGNOSTIC:CORE_40"
    },
    "symbols": {
      "const": [
        "603993.SH",
        "600312.SH",
        "603228.SH"
      ]
    },
    "labels": {
      "const": [
        "NON_PIT_DIAGNOSTIC",
        "NOT_STRATEGY_EVIDENCE",
        "NON_TRADEABLE",
        "LOCAL_ONLY"
      ]
    },
    "decision_cutoff": {
      "type": "string",
      "format": "date-time"
    },
    "retrieval_cutoff": {
      "type": "string",
      "format": "date-time"
    },
    "timezone": {
      "const": "Asia/Shanghai"
    },
    "source_identity": {
      "type": "string",
      "pattern": "^sha256:[0-9a-f]{64}$"
    },
    "rules_hash": {
      "type": "string",
      "pattern": "^sha256:[0-9a-f]{64}$"
    },
    "code_hash": {
      "type": "string",
      "pattern": "^sha256:[0-9a-f]{64}$"
    },
    "schema_hash": {
      "type": "string",
      "pattern": "^sha256:[0-9a-f]{64}$"
    },
    "predecessor_hash": {
      "type": "string",
      "pattern": "^sha256:[0-9a-f]{64}$"
    },
    "content_hash": {
      "type": "string",
      "pattern": "^sha256:[0-9a-f]{64}$"
    },
    "source_admission": {
      "const": "UNVERIFIED_GATEWAY"
    },
    "formal_source_admission": {
      "const": "BLOCKED"
    },
    "reason_codes": {
      "type": "array",
      "minItems": 1,
      "uniqueItems": true,
      "items": {
        "enum": [
          "NON_PIT_DIAGNOSTIC",
          "NOT_STRATEGY_EVIDENCE",
          "NON_TRADEABLE",
          "LOCAL_ONLY",
          "UNVERIFIED_GATEWAY",
          "NO_HISTORICAL_PIT",
          "UNSET_REQUIRED",
          "UNKNOWN_STATUS",
          "NO_EXECUTION_AUTHORITY",
          "SEPARATE_OWNER_AUTHORIZATION_REQUIRED",
          "ACTUAL_FRESH_SESSION_REQUIRED",
          "REAL_FORWARD_NOT_AUTHORIZED",
          "NO_NATIVE_PROMOTION"
        ]
      }
    },
    "invalidation_conditions": {
      "const": [
        "PREDECESSOR_SOURCE_RAW_CHANGED",
        "RULE_CODE_SCHEMA_CHANGED",
        "CUTOFF_NAMESPACE_CHANGED",
        "PRIVATE_PATH_SUBSTITUTION",
        "CALLER_COPY_RESEAL",
        "AUTHORITY_PROMOTION"
      ]
    },
    "provider_identity_verified": {
      "const": false
    },
    "license_verified": {
      "const": false
    },
    "transport_integrity_verified": {
      "const": false
    },
    "historical_visibility_proven": {
      "const": false
    },
    "cloud_transfer": {
      "const": false
    },
    "tradeable": {
      "const": false
    },
    "production_eligible": {
      "const": false
    },
    "can_produce_order": {
      "const": false
    },
    "productionGate": {
      "const": false
    },
    "body": {
      "type": "object",
      "additionalProperties": false,
      "required": [
        "conditions",
        "ENGINE_DIAGNOSTIC_READY",
        "FORMAL_PRICE_BACKTEST_READY",
        "FORMAL_FUNDAMENTAL_PIT_BACKTEST_READY",
        "price_blockers",
        "fundamental_additional_blockers",
        "history_is_current_observed",
        "unset_actual_parameters"
      ],
      "properties": {
        "conditions": {
          "type": "array",
          "minItems": 18,
          "maxItems": 18,
          "prefixItems": [
            {
              "type": "object",
              "additionalProperties": false,
              "required": [
                "domain",
                "state",
                "reason"
              ],
              "properties": {
                "domain": {
                  "const": "source_admission"
                },
                "state": {
                  "enum": [
                    "BLOCKED",
                    "PARTIAL",
                    "READY"
                  ]
                },
                "reason": {
                  "type": "string",
                  "minLength": 1
                }
              }
            },
            {
              "type": "object",
              "additionalProperties": false,
              "required": [
                "domain",
                "state",
                "reason"
              ],
              "properties": {
                "domain": {
                  "const": "provider_identity"
                },
                "state": {
                  "enum": [
                    "BLOCKED",
                    "PARTIAL",
                    "READY"
                  ]
                },
                "reason": {
                  "type": "string",
                  "minLength": 1
                }
              }
            },
            {
              "type": "object",
              "additionalProperties": false,
              "required": [
                "domain",
                "state",
                "reason"
              ],
              "properties": {
                "domain": {
                  "const": "license"
                },
                "state": {
                  "enum": [
                    "BLOCKED",
                    "PARTIAL",
                    "READY"
                  ]
                },
                "reason": {
                  "type": "string",
                  "minLength": 1
                }
              }
            },
            {
              "type": "object",
              "additionalProperties": false,
              "required": [
                "domain",
                "state",
                "reason"
              ],
              "properties": {
                "domain": {
                  "const": "transport_integrity"
                },
                "state": {
                  "enum": [
                    "BLOCKED",
                    "PARTIAL",
                    "READY"
                  ]
                },
                "reason": {
                  "type": "string",
                  "minLength": 1
                }
              }
            },
            {
              "type": "object",
              "additionalProperties": false,
              "required": [
                "domain",
                "state",
                "reason"
              ],
              "properties": {
                "domain": {
                  "const": "raw_bar_readiness"
                },
                "state": {
                  "enum": [
                    "BLOCKED",
                    "PARTIAL",
                    "READY"
                  ]
                },
                "reason": {
                  "type": "string",
                  "minLength": 1
                }
              }
            },
            {
              "type": "object",
              "additionalProperties": false,
              "required": [
                "domain",
                "state",
                "reason"
              ],
              "properties": {
                "domain": {
                  "const": "adjustment_readiness"
                },
                "state": {
                  "enum": [
                    "BLOCKED",
                    "PARTIAL",
                    "READY"
                  ]
                },
                "reason": {
                  "type": "string",
                  "minLength": 1
                }
              }
            },
            {
              "type": "object",
              "additionalProperties": false,
              "required": [
                "domain",
                "state",
                "reason"
              ],
              "properties": {
                "domain": {
                  "const": "corporate_action_readiness"
                },
                "state": {
                  "enum": [
                    "BLOCKED",
                    "PARTIAL",
                    "READY"
                  ]
                },
                "reason": {
                  "type": "string",
                  "minLength": 1
                }
              }
            },
            {
              "type": "object",
              "additionalProperties": false,
              "required": [
                "domain",
                "state",
                "reason"
              ],
              "properties": {
                "domain": {
                  "const": "security_status_history"
                },
                "state": {
                  "enum": [
                    "BLOCKED",
                    "PARTIAL",
                    "READY"
                  ]
                },
                "reason": {
                  "type": "string",
                  "minLength": 1
                }
              }
            },
            {
              "type": "object",
              "additionalProperties": false,
              "required": [
                "domain",
                "state",
                "reason"
              ],
              "properties": {
                "domain": {
                  "const": "suspension_history"
                },
                "state": {
                  "enum": [
                    "BLOCKED",
                    "PARTIAL",
                    "READY"
                  ]
                },
                "reason": {
                  "type": "string",
                  "minLength": 1
                }
              }
            },
            {
              "type": "object",
              "additionalProperties": false,
              "required": [
                "domain",
                "state",
                "reason"
              ],
              "properties": {
                "domain": {
                  "const": "limit_tradability_history"
                },
                "state": {
                  "enum": [
                    "BLOCKED",
                    "PARTIAL",
                    "READY"
                  ]
                },
                "reason": {
                  "type": "string",
                  "minLength": 1
                }
              }
            },
            {
              "type": "object",
              "additionalProperties": false,
              "required": [
                "domain",
                "state",
                "reason"
              ],
              "properties": {
                "domain": {
                  "const": "universe_history"
                },
                "state": {
                  "enum": [
                    "BLOCKED",
                    "PARTIAL",
                    "READY"
                  ]
                },
                "reason": {
                  "type": "string",
                  "minLength": 1
                }
              }
            },
            {
              "type": "object",
              "additionalProperties": false,
              "required": [
                "domain",
                "state",
                "reason"
              ],
              "properties": {
                "domain": {
                  "const": "historical_visibility"
                },
                "state": {
                  "enum": [
                    "BLOCKED",
                    "PARTIAL",
                    "READY"
                  ]
                },
                "reason": {
                  "type": "string",
                  "minLength": 1
                }
              }
            },
            {
              "type": "object",
              "additionalProperties": false,
              "required": [
                "domain",
                "state",
                "reason"
              ],
              "properties": {
                "domain": {
                  "const": "financial_publication_timing"
                },
                "state": {
                  "enum": [
                    "BLOCKED",
                    "PARTIAL",
                    "READY"
                  ]
                },
                "reason": {
                  "type": "string",
                  "minLength": 1
                }
              }
            },
            {
              "type": "object",
              "additionalProperties": false,
              "required": [
                "domain",
                "state",
                "reason"
              ],
              "properties": {
                "domain": {
                  "const": "revision_chronology"
                },
                "state": {
                  "enum": [
                    "BLOCKED",
                    "PARTIAL",
                    "READY"
                  ]
                },
                "reason": {
                  "type": "string",
                  "minLength": 1
                }
              }
            },
            {
              "type": "object",
              "additionalProperties": false,
              "required": [
                "domain",
                "state",
                "reason"
              ],
              "properties": {
                "domain": {
                  "const": "industry_history"
                },
                "state": {
                  "enum": [
                    "BLOCKED",
                    "PARTIAL",
                    "READY"
                  ]
                },
                "reason": {
                  "type": "string",
                  "minLength": 1
                }
              }
            },
            {
              "type": "object",
              "additionalProperties": false,
              "required": [
                "domain",
                "state",
                "reason"
              ],
              "properties": {
                "domain": {
                  "const": "transaction_cost_policy"
                },
                "state": {
                  "enum": [
                    "BLOCKED",
                    "PARTIAL",
                    "READY"
                  ]
                },
                "reason": {
                  "type": "string",
                  "minLength": 1
                }
              }
            },
            {
              "type": "object",
              "additionalProperties": false,
              "required": [
                "domain",
                "state",
                "reason"
              ],
              "properties": {
                "domain": {
                  "const": "account_policy"
                },
                "state": {
                  "enum": [
                    "BLOCKED",
                    "PARTIAL",
                    "READY"
                  ]
                },
                "reason": {
                  "type": "string",
                  "minLength": 1
                }
              }
            },
            {
              "type": "object",
              "additionalProperties": false,
              "required": [
                "domain",
                "state",
                "reason"
              ],
              "properties": {
                "domain": {
                  "const": "strategy_parameter_freeze"
                },
                "state": {
                  "enum": [
                    "BLOCKED",
                    "PARTIAL",
                    "READY"
                  ]
                },
                "reason": {
                  "type": "string",
                  "minLength": 1
                }
              }
            }
          ],
          "items": false
        },
        "ENGINE_DIAGNOSTIC_READY": {
          "const": "READY"
        },
        "FORMAL_PRICE_BACKTEST_READY": {
          "const": "BLOCKED"
        },
        "FORMAL_FUNDAMENTAL_PIT_BACKTEST_READY": {
          "const": "BLOCKED"
        },
        "price_blockers": {
          "type": "array",
          "minItems": 1,
          "uniqueItems": true,
          "items": {
            "enum": [
              "source_admission",
              "provider_identity",
              "license",
              "transport_integrity",
              "raw_bar_readiness",
              "adjustment_readiness",
              "corporate_action_readiness",
              "security_status_history",
              "suspension_history",
              "limit_tradability_history",
              "universe_history",
              "historical_visibility",
              "financial_publication_timing",
              "revision_chronology",
              "industry_history",
              "transaction_cost_policy",
              "account_policy",
              "strategy_parameter_freeze"
            ]
          }
        },
        "fundamental_additional_blockers": {
          "type": "array",
          "minItems": 1,
          "uniqueItems": true,
          "items": {
            "enum": [
              "source_admission",
              "provider_identity",
              "license",
              "transport_integrity",
              "raw_bar_readiness",
              "adjustment_readiness",
              "corporate_action_readiness",
              "security_status_history",
              "suspension_history",
              "limit_tradability_history",
              "universe_history",
              "historical_visibility",
              "financial_publication_timing",
              "revision_chronology",
              "industry_history",
              "transaction_cost_policy",
              "account_policy",
              "strategy_parameter_freeze"
            ]
          }
        },
        "history_is_current_observed": {
          "const": true
        },
        "unset_actual_parameters": {
          "const": 30
        }
      }
    }
  },
  "x-contract": {
    "version": "1.0.0",
    "required": "All listed fields; no optional extra fields",
    "enum": "Closed purpose/scope/state/reason registries",
    "unit": "Diagnostic DPU100 integer minor units; no actual CNY numeric parameters here",
    "money": "No binary floats; synthetic Decimal100 HALF_EVEN only in private diagnostic ledger",
    "timezone": "Explicit RFC3339 instant plus timezone Asia/Shanghai; DATE_ONLY is not instant",
    "hash_trace": "SHA256 source/rules/code/schema/predecessor/content plus object/trace/version",
    "invalidation": "Any source/version/cutoff/path/authority drift; display shape never issuance authority"
  }
}
