{"body":{"ENGINE_DIAGNOSTIC_READY":"READY","FORMAL_FUNDAMENTAL_PIT_BACKTEST_READY":"BLOCKED","FORMAL_PRICE_BACKTEST_READY":"BLOCKED","conditions":[{"domain":"source_admission","reason":"Underlying gateway QUARANTINED; API access is not admission.","state":"BLOCKED"},{"domain":"provider_identity","reason":"Seller/channel identity independently UNVERIFIED.","state":"BLOCKED"},{"domain":"license","reason":"Purpose/storage/transfer/license grants independently UNVERIFIED.","state":"BLOCKED"},{"domain":"transport_integrity","reason":"Original gateway HTTP; integrity independently UNVERIFIED.","state":"BLOCKED"},{"domain":"raw_bar_readiness","reason":"327 aligned current-observed sessions usable for diagnostics only; formal source/PIT unproven.","state":"PARTIAL"},{"domain":"adjustment_readiness","reason":"Same-provider factors only; no independent authoritative adjustment.","state":"PARTIAL"},{"domain":"corporate_action_readiness","reason":"5 ambiguities and 8 pre_close deltas preserved; tolerance/rounding UNSET_REQUIRED.","state":"PARTIAL"},{"domain":"security_status_history","reason":"Historical ST/delist/status absent; current terminal schema failures preserved.","state":"BLOCKED"},{"domain":"suspension_history","reason":"Historical suspension coverage UNKNOWN; absence is not clear status.","state":"BLOCKED"},{"domain":"limit_tradability_history","reason":"Historical daily limits/executability UNKNOWN; assumption never proof.","state":"BLOCKED"},{"domain":"universe_history","reason":"Three present-day engineer-selected securities; survivorship/selection not historical universe.","state":"BLOCKED"},{"domain":"historical_visibility","reason":"Today-retrieved historical dates have no past decision-time available_at proof.","state":"BLOCKED"},{"domain":"financial_publication_timing","reason":"ann_date/f_ann_date DATE_ONLY literals; historical first visibility UNKNOWN.","state":"BLOCKED"},{"domain":"revision_chronology","reason":"Current versions/update_flag cannot reconstruct independent revision availability.","state":"BLOCKED"},{"domain":"industry_history","reason":"Current membership cannot be backfilled into historical universe or features.","state":"BLOCKED"},{"domain":"transaction_cost_policy","reason":"Only synthetic DPU scenarios; actual dated fees/minimum/tax/slippage UNSET.","state":"BLOCKED"},{"domain":"account_policy","reason":"Actual capital/account/broker/risk unknown; 30 UNSET_REQUIRED.","state":"BLOCKED"},{"domain":"strategy_parameter_freeze","reason":"Diagnostic rule frozen; formal strategy/risk configuration UNSET_REQUIRED.","state":"PARTIAL"}],"fundamental_additional_blockers":["financial_publication_timing","revision_chronology","industry_history"],"history_is_current_observed":true,"price_blockers":["source_admission","provider_identity","license","transport_integrity","raw_bar_readiness","adjustment_readiness","corporate_action_readiness","security_status_history","suspension_history","limit_tradability_history","universe_history","historical_visibility","transaction_cost_policy","account_policy","strategy_parameter_freeze"],"unset_actual_parameters":30},"can_produce_order":false,"cloud_transfer":false,"code_hash":"sha256:ff38afe7f6833c723873426771a9f532bc867bae87c1af8de3581e2c2558a375","content_hash":"sha256:6fde8144c4244bcc96f3bbbafc56b853332132fbdba0e884695769d4ff5d90e9","contract_name":"HistoricalBacktestReadiness","contract_version":"1.0.0","decision_cutoff":"2026-10-06T12:37:32.209051Z","formal_source_admission":"BLOCKED","historical_visibility_proven":false,"invalidation_conditions":["PREDECESSOR_SOURCE_RAW_CHANGED","RULE_CODE_SCHEMA_CHANGED","CUTOFF_NAMESPACE_CHANGED","PRIVATE_PATH_SUBSTITUTION","CALLER_COPY_RESEAL","AUTHORITY_PROMOTION"],"labels":["NON_PIT_DIAGNOSTIC","NOT_STRATEGY_EVIDENCE","NON_TRADEABLE","LOCAL_ONLY"],"license_verified":false,"namespace":"LOCAL_ENGINE_DIAGNOSTIC:CORE_40","object_id":"wave-e:HistoricalBacktestReadiness:0be239596f6af446","object_version":1,"predecessor_hash":"sha256:2e4a58f9eeea4a348cbb73b0d7ba4124b9a95a4b7e922919d254bcf35441c656","productionGate":false,"production_eligible":false,"provider_identity_verified":false,"reason_codes":["NON_PIT_DIAGNOSTIC","NOT_STRATEGY_EVIDENCE","NON_TRADEABLE","LOCAL_ONLY","UNVERIFIED_GATEWAY","NO_HISTORICAL_PIT","UNSET_REQUIRED","UNKNOWN_STATUS","NO_EXECUTION_AUTHORITY","SEPARATE_OWNER_AUTHORIZATION_REQUIRED","ACTUAL_FRESH_SESSION_REQUIRED","REAL_FORWARD_NOT_AUTHORIZED","NO_NATIVE_PROMOTION"],"retrieval_cutoff":"2026-10-06T12:24:18.256865Z","rules_hash":"sha256:6f3f491bca2f9de0ed7d9a47f94c8ab4ba9abe067e3a836189747202c8214869","schema_hash":"sha256:d4b10d9720519e4afaf8c3f2ca34f8891046e0cab1331c5602f4ce54c6967822","source_admission":"UNVERIFIED_GATEWAY","source_identity":"sha256:0be239596f6af446b75d7655a391575fe231da2b3863dc462c7ccb9f4a5d42e9","symbols":["603993.SH","600312.SH","603228.SH"],"timezone":"Asia/Shanghai","trace_id":"wave-e:0be239596f6af446b75d7655a391575fe231da2b3863dc462c7ccb9f4a5d42e9","tradeable":false,"transport_integrity_verified":false}
